{
  "$schema": "https://schema.management.azure.com/schemas/2019-04-01/deploymentTemplate.json#",
  "contentVersion": "1.0.0.0",
  "Parameters": {
    "Workspace": {
      "type": "string"
    }
  },
  "resources": [
    {
      "id": "[concat(resourceId('Microsoft.OperationalInsights/workspaces/providers', parameters('workspace'), 'Microsoft.SecurityInsights'),'/alertRules/122fbc6a-57ab-4aa7-b9a9-51ac4970cac1')]",
      "name": "[concat(parameters('workspace'),'/Microsoft.SecurityInsights/122fbc6a-57ab-4aa7-b9a9-51ac4970cac1')]",
      "type": "Microsoft.OperationalInsights/workspaces/providers/alertRules",
      "kind": "Scheduled",
      "apiVersion": "2021-03-01-preview",
      "properties": {
        "severity": "Medium",
        "customDetails": {
          "AzureUserAgent": "UserAgent",
          "AWSAlertUserName": "RDSUser",
          "AzAuthRequirement": "AuthenticationRequirement",
          "AWSAplicationName": "RDSApplication",
          "AWSArn": "Arn",
          "AzConditionalAccess": "ConditionalAccessStatus",
          "AzureRiskDetail": "RiskDetail",
          "AWSInstanceId": "RDSInstanceId",
          "AWSresourceType": "AWSresourceType",
          "alertSeverity": "Severity",
          "AWSInstanceType": "RDSactionType",
          "AzureClientAppUsed": "ClientAppUsed",
          "AzureUser": "UserPrincipalName",
          "AzureOperationName": "OperationName"
        },
        "tactics": [
          "CredentialAccess",
          "InitialAccess"
        ],
        "queryPeriod": "1d",
        "entityMappings": [
          {
            "entityType": "IP",
            "fieldMappings": [
              {
                "columnName": "IPAddress",
                "identifier": "Address"
              }
            ]
          },
          {
            "entityType": "Account",
            "fieldMappings": [
              {
                "columnName": "UserPrincipalName",
                "identifier": "FullName"
              },
              {
                "columnName": "Name",
                "identifier": "Name"
              },
              {
                "columnName": "UPNSuffix",
                "identifier": "UPNSuffix"
              }
            ]
          }
        ],
        "triggerThreshold": 0,
        "alertDetailsOverride": {
          "alertSeverityColumnName": "Severity",
          "alertDescriptionFormat": "This detection correlates AWS GuardDuty Credential Access alert described '{{AWSAlertDescription}}' related to Amazon Relational Database Service (RDS) activity with Azure portal sign-in activities. It identifies successful and failed logins, anomalous behavior, and malicious IP access. By joining these datasets on network entities and IP addresses, it detects unauthorized credential access attempts across AWS and Azure resources, enhancing cross-cloud security monitoring. \n\n AWS ALert Link : '{{AWSAlertLink}}' \n\n Find More Details :https://docs.aws.amazon.com/guardduty/latest/ug/guardduty_finding-types-active.html",
          "alertDynamicProperties": [
            {
              "alertProperty": "AlertLink",
              "value": "AWSAlertLink"
            },
            {
              "alertProperty": "ProviderName",
              "value": "AWS"
            },
            {
              "alertProperty": "ProductName",
              "value": "AWSGuardDuty"
            },
            {
              "alertProperty": "ProductComponentName",
              "value": "AWSGuardDuty"
            }
          ],
          "alertDisplayNameFormat": "IP address {{IPAddress}} in {{AWSAlertTitle}} seen in Azure Signin Logs with {{UserPrincipalName}}"
        },
        "query": "// Define variable 'AwsAlert' to collect AWS GuardDuty CredentialAccess alerts related to Amazon Relational Database Service (RDS) activity\nlet AwsAlert = materialize (\n    AWSGuardDuty\n    | where ActivityType has_any (\n        \"CredentialAccess:RDS/TorIPCaller.SuccessfulLogin\",\n        \"CredentialAccess:RDS/TorIPCaller.FailedLogin\",\n        \"CredentialAccess:RDS/AnomalousBehavior.SuccessfulBruteForce\",\n        \"CredentialAccess:RDS/AnomalousBehavior.SuccessfulLogin\",\n        \"CredentialAccess:RDS/MaliciousIPCaller.SuccessfulLogin\",\n        \"CredentialAccess:RDS/MaliciousIPCaller.FailedLogin\"\n        )\n    | extend\n        AWSAlertId = Id, \n        AWSAlertTitle = Title,\n        AWSAlertDescription = Description,\n        AWSresourceType = tostring(parse_json(ResourceDetails).resourceType),\n        AWSNetworkEntity = tostring(parse_json(ServiceDetails).action.rdsLoginAttemptAction.remoteIpDetails.ipAddressV4),\n        RDSInstanceId = tostring(parse_json(ResourceDetails).rdsDbInstanceDetails.dbInstanceIdentifier),\n        RDSUser = tostring(parse_json(ResourceDetails).rdsDbUserDetails.user),\n        RDSApplication = tostring(parse_json(ResourceDetails).rdsDbUserDetails.application),\n        RDSactionType = tostring(parse_json(ServiceDetails).action.actionType),\n        AWSAlertTime = TimeCreated,\n        AWSAlertLink= tostring(strcat('https://us-east-1.console.aws.amazon.com/guardduty/home?region=us-east-1#/findings?macros=current&fId=',Id)),\n        Severity = \n  case (\n    Severity >= 7.0, \"High\",\n    Severity between (4.0 .. 6.9), \"Medium\",\n    Severity between (1.0 .. 3.9), \"Low\",\n    \"Unknown\")\n    | distinct\n        AWSAlertTime,\n        ActivityType,\n        AWSAlertId,\n        AWSAlertLink,\n        AWSAlertTitle,\n        AWSAlertDescription,\n        AWSresourceType,\n        Arn,\n        Severity,\n        RDSactionType,\n        RDSApplication,\n        RDSInstanceId,\n        RDSUser,\n        AWSNetworkEntity\n    );\n  // Define variable 'Azure_sigin' to collect Azure portal sign-in activities\n  let Azure_sigin = materialize (\n      SigninLogs\n      | where AppDisplayName == \"Azure Portal\"\n      | where isnotempty(OriginalRequestId)\n      | summarize \n          AzureSuccessfulEvent = countif(ResultType == 0), \n          AzureFailedEvent = countif(ResultType != 0), \n          totalAzureLoginEventId = dcount(OriginalRequestId), \n          AzureFailedEventsCount = dcountif(OriginalRequestId, ResultType != 0), \n          AzureSuccessfuleventsCount = dcountif(OriginalRequestId, ResultType == 0),\n          AzureSetOfFailedevents = makeset(iff(ResultType != 0, OriginalRequestId, \"\"), 5), \n          AzureSetOfSuccessfulEvents = makeset(iff(ResultType == 0, OriginalRequestId, \"\"), 5) \n          by \n          IPAddress, \n          UserPrincipalName, \n          bin(TimeGenerated, 1min), \n          UserAgent,\n          ConditionalAccessStatus,\n          OperationName,\n          RiskDetail,\n          AuthenticationRequirement,\n          ClientAppUsed\n      // Extracting the name and UPN suffix from UserPrincipalName\n      | extend\n          Name = tostring(split(UserPrincipalName, '@')[0]),\n          UPNSuffix = tostring(split(UserPrincipalName, '@')[1])\n      );\n  // Join 'AwsAlert' and 'Azure_sigin' on the AWS Network Entity and Azure IP Address\n  AwsAlert\n  | join kind=inner Azure_sigin on $left.AWSNetworkEntity == $right.IPAddress\n",
        "queryFrequency": "1d",
        "description": "'This detection correlates AWS GuardDuty Credential Access alerts related to Amazon Relational Database Service (RDS) activity with Azure portal sign-in activities. It identifies successful and failed logins, anomalous behavior, and malicious IP access. By joining these datasets on network entities and IP addresses, it detects unauthorized credential access attempts across AWS and Azure resources, enhancing cross-cloud security monitoring.'\n",
        "triggerOperator": "gt",
        "name": "Cross-Cloud Unauthorized Credential Access Detection From AWS RDS Login"
      }
    }
  ]
}
