{
  "$schema": "https://schema.management.azure.com/schemas/2019-04-01/deploymentTemplate.json#",
  "contentVersion": "1.0.0.0",
  "Parameters": {
    "Workspace": {
      "type": "string"
    }
  },
  "resources": [
    {
      "id": "[concat(resourceId('Microsoft.OperationalInsights/workspaces/providers', parameters('workspace'), 'Microsoft.SecurityInsights'),'/alertRules/1cc0ba27-c5ca-411a-a779-fbc89e26be83')]",
      "name": "[concat(parameters('workspace'),'/Microsoft.SecurityInsights/1cc0ba27-c5ca-411a-a779-fbc89e26be83')]",
      "type": "Microsoft.OperationalInsights/workspaces/providers/alertRules",
      "kind": "Scheduled",
      "apiVersion": "2021-03-01-preview",
      "properties": {
        "customDetails": {
          "AlertProDuctName": "ProductName",
          "CorrelationWith": "GCPAuditLogs",
          "GCPUserAgent": "GCPUserUA",
          "AlertUserObjectId": "AccountObjectId",
          "GCPProjectId": "ProjectId",
          "AlertIp": "EntityIp",
          "AlertIds": "SystemAlertIds",
          "AlertUserName": "AccountUPN",
          "GCPVMName": "VMName",
          "GCPVMType": "VMType",
          "AlertName": "AlertName"
        },
        "description": "'This detection identifies high-severity alerts across various Microsoft security products, including Microsoft Defender XDR and Microsoft Entra ID, and correlates them with instances of Google Cloud VM creation. It focuses on instances where VMs were created within a short timeframe of high-severity alerts, potentially indicating suspicious activity.'\n",
        "name": "Suspicious VM Instance Creation Activity Detected",
        "query": "// Filter alerts from specific Microsoft security products with medium and high severity\nSecurityAlert \n| where ProductName in (\"Microsoft 365 Defender\", \"Azure Active Directory\", \"Microsoft Defender Advanced Threat Protection\", \"Microsoft Cloud App Security\", \"Azure Active Directory Identity Protection\", \"Microsoft Defender ATP\")\n| where AlertSeverity has_any (\"Medium\", \"High\")\n// Parse JSON entities and extend AlertTimeGenerated\n| extend Entities = parse_json(Entities), AlertTimeGenerated=TimeGenerated\n// Extract and process IP entities\n| mv-apply Entity = Entities on \n    ( \n    where Entity.Type == 'ip' \n    | extend EntityIp = tostring(Entity.Address) \n    ) \n// Extract and process account entities\n| mv-apply Entity = Entities on \n    ( \n    where Entity.Type == 'account' \n    | extend AccountObjectId = tostring(Entity.AadUserId)\n    )\n// Filter out records with empty EntityIp\n| where isnotempty(EntityIp)\n// Summarize data and create sets of entities and system alert IDs\n| summarize Entitys=make_set(Entity), SystemAlertIds=make_set(SystemAlertId)\n    by \n    AlertName,\n    ProductName,\n    AlertSeverity,\n    EntityIp,\n    Tactics,\n    Techniques,\n    ProviderName,\n    AlertTime= bin(AlertTimeGenerated, 1d),\n    AccountObjectId\n// Join with GCPAuditLogs for VM instance creation\n| join kind=inner (\n    GCPAuditLogs\n    | where ServiceName == \"compute.googleapis.com\" and MethodName endswith \"instances.insert\"\n    | extend\n        GCPUserUPN= tostring(parse_json(AuthenticationInfo).principalEmail),\n        GCPUserIp = tostring(parse_json(RequestMetadata).callerIp),\n        GCPUserUA= tostring(parse_json(RequestMetadata).callerSuppliedUserAgent),\n        VMStatus =  tostring(parse_json(Response).status),\n        VMOperation=tostring(parse_json(Response).operationType),\n        VMName= tostring(parse_json(Request).name),\n        VMType = tostring(split(parse_json(Request).machineType, \"/\")[-1])\n    | where GCPUserUPN !has \"gserviceaccount.com\"\n    | where VMOperation == \"insert\" and isnotempty(GCPUserIp) and GCPUserIp != \"private\"\n    | project\n        GCPOperationTime=TimeGenerated,\n        VMName,\n        VMStatus,\n        MethodName,\n        GCPUserUPN,\n        ProjectId,\n        GCPUserIp,\n        GCPUserUA,\n        VMOperation,\n        VMType\n    )\n    on $left.EntityIp == $right.GCPUserIp \n// Join with IdentityInfo to enrich user identity details\n| join kind=inner (IdentityInfo \n    | distinct AccountObjectId, AccountUPN, JobTitle\n    )\n    on AccountObjectId \n// Calculate the time difference between the alert and VM creation for further analysis\n| extend TimeDiff= datetime_diff('day', AlertTime, GCPOperationTime),Name = split(GCPUserUPN, \"@\")[0], UPNSuffix = split(GCPUserUPN, \"@\")[1]\n",
        "queryPeriod": "1d",
        "triggerOperator": "gt",
        "entityMappings": [
          {
            "entityType": "IP",
            "fieldMappings": [
              {
                "identifier": "Address",
                "columnName": "GCPUserIp"
              }
            ]
          },
          {
            "entityType": "Account",
            "fieldMappings": [
              {
                "identifier": "FullName",
                "columnName": "GCPUserUPN"
              },
              {
                "identifier": "Name",
                "columnName": "Name"
              },
              {
                "identifier": "UPNSuffix",
                "columnName": "UPNSuffix"
              }
            ]
          }
        ],
        "tactics": [
          "InitialAccess",
          "Execution",
          "Discovery"
        ],
        "queryFrequency": "1d",
        "alertDetailsOverride": {
          "alertDynamicProperties": [
            {
              "alertProperty": "ProviderName",
              "value": "Microsoft Security"
            },
            {
              "alertProperty": "ProductName",
              "value": "Microsoft Defender"
            },
            {
              "alertProperty": "ProductComponentName",
              "value": "Microsoft Defender"
            }
          ],
          "alertDescriptionFormat": "This detection correlates '{{ProductName}}' Alert IP addresse Entity found in VM instance creation in GCP {{ProjectId}}. It identifies successful compute instance creation, from suspicious IP addresse. By joining these datasets on network entities and IP addresses, it detects unauthorized Initial access attempts across GCP environments.",
          "alertDisplayNameFormat": "IP address {{GCPUserIp}} Assocated with {{AlertName}} found in GCP VM creation event by {{GCPUserUPN}}",
          "alertSeverityColumnName": "AlertSeverity"
        },
        "triggerThreshold": 0,
        "severity": "Medium"
      }
    }
  ]
}
